{
  "shot_count": 10,
  "shot_duration_seconds": 10,
  "story_bible_hash": "c2b8432f797bdb5576c17a8d5a91927cccdf32ce700703353ddeb0f34419cdc3",
  "master_prompt_phase_1": "# PHASE 1 — STORYBOARD FIRST PROMPT\n\n<<<STORY_BIBLE_START>>>\nชื่อเรื่อง: จดหมายถึงวันพรุ่งนี้\nตัวละครหลัก: หญิงไทยอายุ 28 ปี ผมยาวสีดำ เสื้อเชิ้ตสีขาว กางเกงผ้าสีครีม มีแหวนเงินที่นิ้วกลางขวา ต้องเหมือนเดิมทุก shot\nโลกของเรื่อง: เมืองเก่ากรุงเทพฯ หลังฝนตก แสงไฟสะท้อนพื้นถนน บรรยากาศอบอุ่นปนเหงา\nกฎต่อเนื่อง: ห้ามเปลี่ยนเสื้อผ้า ห้ามเปลี่ยนหน้าตา ห้ามเพิ่มตัวละครหลักใหม่ ห้ามมีมือแปลกปลอม ห้าม second-person POV\nเสียง: บทพูดและ voiceover ต้องเป็นภาษาไทยเท่านั้น มี ambient เมืองหลังฝนตกและดนตรี piano เบา ๆ ต่อเนื่อง\n<<<STORY_BIBLE_END>>>\n\nHEADER — video type: cinematic short film; total clips: 10; duration: 10 seconds per shot; character: หญิงไทยอายุ 28 ปี ผมยาวสีดำ เสื้อเชิ้ตสีขาว กางเกงผ้าสีครีม บุคลิกสุขุม อ่อนโยน มีแหวนเงินวงเล็กที่นิ้วกลางขวา; setting: ย่านเมืองเก่ากรุงเทพฯ ช่วงเย็นหลังฝนตก ถนนสะท้อนแสงไฟร้านค้า โทนอบอุ่นปนเหงา.\n\nWORKFLOW block — ทำ storyboard ก่อนเสมอ ห้ามข้ามไป generate clip ทันที ต้องแตกเรื่องเป็น 10 shots ตามลำดับเหตุการณ์ก่อน แล้วจึงใช้แต่ละ shot ไปสร้าง clip.\n\nCHARACTER LOCK — รักษาหน้าตา เสื้อผ้า อายุ สัดส่วน สีผิว ทรงผม บุคลิก และ prop ของตัวละครให้ตรง Story Bible ทุก shot. ป้องกัน phantom hands, extra fingers, unwanted second person POV, character drift, face drift, outfit drift, และ unwanted extra people. Forbidden: phantom hands; extra fingers; unwanted second person POV; English dialogue or English translation; character face drift; inconsistent clothing; unwanted extra people.\n\nAUDIO RULE — ทุก clip ต้องมีเสียงเสมอ ทั้ง lip-sync เมื่อมีบทพูด, voiceover เมื่อมี narration, music bed และ ambient sound ที่ตรงกับฉาก. ห้าม silent clip.\n\nPRODUCTION SPECS — ทุก shot ยาว 10 seconds เท่านั้น; style: cinematic realistic, high detail, soft film grain; lighting: golden hour mixed with warm shop lights after rain; camera rules: ใช้ shot type ต่างกันในแต่ละ shot มี movement นุ่ม ต่อเนื่อง และไม่ตัดข้ามอารมณ์แรงเกินไป; aspect ratio: 16:9.\n\nTHE N SCENES — สร้าง storyboard จำนวน 10 scenes/shots ให้ครบถ้วน แต่ละ shot ต้องใช้ shot type ที่ต่างกันหรือมี camera movement ต่างกัน มี action ต่อเนื่อง และมีบทพูดไทยหรือเสียงบรรยายไทยที่เหมาะสม.\n\nAUDIO global — music: soft piano with gentle strings; voice tone: เสียงผู้หญิงไทยธรรมชาติ อบอุ่น แผ่วแต่ชัด; ambient: เสียงฝนหยุดใหม่ ๆ รถไกล ๆ คนเดินเบา ๆ และเสียงร้านค้าในเมืองเก่า.\n\nPLOT SUMMARY — หญิงคนหนึ่งพบจดหมายเก่าที่ตัวเองเขียนไว้ในวัยเด็ก เธอเดินผ่านสถานที่เก่าหลายจุดในเมือง ก่อนตัดสินใจให้อภัยตัวเองและเริ่มต้นใหม่ในตอนท้าย",
  "master_prompt_phase_2": "# PHASE 2 — GENERATE CLIPS PROMPT\n\n<<<STORY_BIBLE_START>>>\nชื่อเรื่อง: จดหมายถึงวันพรุ่งนี้\nตัวละครหลัก: หญิงไทยอายุ 28 ปี ผมยาวสีดำ เสื้อเชิ้ตสีขาว กางเกงผ้าสีครีม มีแหวนเงินที่นิ้วกลางขวา ต้องเหมือนเดิมทุก shot\nโลกของเรื่อง: เมืองเก่ากรุงเทพฯ หลังฝนตก แสงไฟสะท้อนพื้นถนน บรรยากาศอบอุ่นปนเหงา\nกฎต่อเนื่อง: ห้ามเปลี่ยนเสื้อผ้า ห้ามเปลี่ยนหน้าตา ห้ามเพิ่มตัวละครหลักใหม่ ห้ามมีมือแปลกปลอม ห้าม second-person POV\nเสียง: บทพูดและ voiceover ต้องเป็นภาษาไทยเท่านั้น มี ambient เมืองหลังฝนตกและดนตรี piano เบา ๆ ต่อเนื่อง\n<<<STORY_BIBLE_END>>>\n\nLANGUAGE LOCK — ใช้เสียงไทยเท่านั้น ห้ามแปลบทพูดไทยเป็น English ห้ามใส่ English subtitles เว้นแต่ผู้ใช้สั่งเพิ่มเอง ทุก dialogue ต้องเป็นภาษาไทยและคง marker (เสียงไทย).\n\nAUDIO RULE — ทุก clip ต้องมี audio ครบ: dialogue/lip-sync เมื่อมีคนพูด, voiceover เมื่อมี narration, music, ambient, room tone/scene tone. ห้าม silent clip และห้ามเสียงขาดช่วง.\n\nGENERATE N CLIPS instruction — Generate exactly 10 clips. Each clip is exactly 10 seconds. Create one prompt per clip and preserve story continuity from Shot 1 to Shot 10.\n\nTHAI DIALOGUE PER CLIP — ทุก clip ต้องระบุบทพูดไทยพร้อม marker (เสียงไทย). ถ้า shot ไม่มีบทพูด ให้ใช้ voiceover ไทยสั้น ๆ พร้อม marker (เสียงไทย).\n\nGLOBAL AUDIO MIX — mix voice + music + ambient ให้บาลานซ์ เสียงพูดไทยต้องชัดกว่า music, ambient ต้อง support setting, music ต้องต่อเนื่องตลอดเรื่อง.\n\nCHARACTER LOCK reminder — ใช้ตัวละครเดิมจาก Story Bible แบบไม่เปลี่ยนหน้า เสื้อผ้า ทรงผม prop และบุคลิก ห้าม phantom hands, ห้าม second-person POV ที่ทำให้มือ/ร่างของผู้ชมโผล่เข้าฉาก, ห้าม extra limbs, ห้ามตัวละครใหม่ที่ไม่ได้ระบุ.",
  "shot_prompts": [
    {
      "shot_number": 1,
      "duration_seconds": 10,
      "shot_type": "wide establishing shot",
      "thai_dialogue": "คืนนี้เมืองดูเหมือนจำฉันได้มากกว่าที่ฉันจำตัวเองได้ (เสียงไทย)",
      "prompt": "# VIDEO PROMPT — SHOT 01/10\n\n<<<STORY_BIBLE_START>>>\nชื่อเรื่อง: จดหมายถึงวันพรุ่งนี้\nตัวละครหลัก: หญิงไทยอายุ 28 ปี ผมยาวสีดำ เสื้อเชิ้ตสีขาว กางเกงผ้าสีครีม มีแหวนเงินที่นิ้วกลางขวา ต้องเหมือนเดิมทุก shot\nโลกของเรื่อง: เมืองเก่ากรุงเทพฯ หลังฝนตก แสงไฟสะท้อนพื้นถนน บรรยากาศอบอุ่นปนเหงา\nกฎต่อเนื่อง: ห้ามเปลี่ยนเสื้อผ้า ห้ามเปลี่ยนหน้าตา ห้ามเพิ่มตัวละครหลักใหม่ ห้ามมีมือแปลกปลอม ห้าม second-person POV\nเสียง: บทพูดและ voiceover ต้องเป็นภาษาไทยเท่านั้น มี ambient เมืองหลังฝนตกและดนตรี piano เบา ๆ ต่อเนื่อง\n<<<STORY_BIBLE_END>>>\n\nPHASE 1 — STORYBOARD STRUCTURE\n\nHEADER — video type: cinematic short film; shot: 1/10; duration: exactly 10 seconds; character: หญิงไทยอายุ 28 ปี ผมยาวสีดำ เสื้อเชิ้ตสีขาว กางเกงผ้าสีครีม บุคลิกสุขุม อ่อนโยน มีแหวนเงินวงเล็กที่นิ้วกลางขวา; setting: ย่านเมืองเก่ากรุงเทพฯ ช่วงเย็นหลังฝนตก ถนนสะท้อนแสงไฟร้านค้า โทนอบอุ่นปนเหงา.\n\nWORKFLOW block — ใช้ Story Bible ก่อน วาง storyboard ของ shot นี้ให้ต่อเนื่องกับ shot ก่อนหน้าและ shot ถัดไป จากนั้นจึง generate clip ห้ามข้ามขั้นตอน storyboard.\n\nCHARACTER LOCK — ตัวละครต้องเหมือนเดิม 100% ตาม Story Bible: หน้า เสื้อผ้า ทรงผม อายุ สัดส่วน สีผิว prop และบุคลิกต้องต่อเนื่อง. ห้าม phantom hands, extra fingers, second-person POV, extra limbs, face drift, outfit drift, และ unwanted extra people. Forbidden: phantom hands; extra fingers; unwanted second person POV; English dialogue or English translation; character face drift; inconsistent clothing; unwanted extra people.\n\nAUDIO RULE — shot นี้ต้องมีเสียงครบ: lip-sync ตรงบทพูด, voiceover ถ้ามี narration, music bed, ambient sound, room tone. ห้าม silent clip.\n\nPRODUCTION SPECS — duration exactly 10 seconds; style: cinematic realistic, high detail, soft film grain; lighting: golden hour mixed with warm shop lights after rain; camera rules: ใช้ shot type ต่างกันในแต่ละ shot มี movement นุ่ม ต่อเนื่อง และไม่ตัดข้ามอารมณ์แรงเกินไป; aspect ratio: 16:9.\n\nTHE N SCENES — This is shot 1 of exactly 10 scenes. Shot type: wide establishing shot. Beat: เปิดเมืองเก่าหลังฝนตก ตัวละครเดินเข้ากรอบภาพ. Action: เธอเดินช้า ๆ บนถนนเปียกฝน มองแสงสะท้อนบนพื้น.\n\nAUDIO global — music: soft piano with gentle strings; voice tone: เสียงผู้หญิงไทยธรรมชาติ อบอุ่น แผ่วแต่ชัด; ambient: เสียงฝนหยุดใหม่ ๆ รถไกล ๆ คนเดินเบา ๆ และเสียงร้านค้าในเมืองเก่า.\n\nPHASE 2 — CLIP GENERATION RULES\n\nLANGUAGE LOCK — ใช้เสียงไทยเท่านั้น ห้ามแปลเป็น English ห้าม English dialogue ห้าม English subtitles. Dialogue/voiceover ต้องเป็นภาษาไทยและมี marker (เสียงไทย).\n\nAUDIO RULE — audio ของ shot นี้ต้องครบทุกชั้น: Thai dialogue/lip-sync, voiceover if needed, music, ambient, scene tone. เสียงพูดไทยต้องชัดกว่า music.\n\nGENERATE N CLIPS instruction — Generate clip 1/10; this clip duration is exactly 10 seconds; preserve continuity with the same Story Bible used in every prompt.\n\nTHAI DIALOGUE PER CLIP — คืนนี้เมืองดูเหมือนจำฉันได้มากกว่าที่ฉันจำตัวเองได้ (เสียงไทย) Voiceover: เสียงบรรยายไทยเสริมเฉพาะเมื่อจำเป็น ไม่ทับบทพูดหลัก (เสียงไทย).\n\nGLOBAL AUDIO MIX — ambient ฝนหยุดใหม่ ๆ piano เริ่มเบา ๆ. Mix voice + music + ambient naturally; no silent gaps; no mismatched ambience.\n\nCHARACTER LOCK reminder — ย้ำอีกครั้ง: ตัวละคร ฉาก prop เสื้อผ้า สีผม ใบหน้า และโทนภาพต้องตรงกับ Story Bible แบบต่อเนื่อง ห้าม phantom hands และห้าม second-person POV.\n\nFINAL GENERATION INSTRUCTION — สร้างวิดีโอ shot นี้เป็น cinematic clip ความยาว 10 วินาที โดยยึด Story Bible, shot type, action, Thai dialogue, audio mix, production specs และ continuity lock ทั้งหมดข้างต้น.",
      "story_bible_hash": "c2b8432f797bdb5576c17a8d5a91927cccdf32ce700703353ddeb0f34419cdc3",
      "contains_story_bible": true
    },
    {
      "shot_number": 2,
      "duration_seconds": 10,
      "shot_type": "medium tracking shot",
      "thai_dialogue": "บทพูดไทยสำหรับ Shot 2 ที่สอดคล้องกับเรื่อง (เสียงไทย)",